PROYECTO,REQUISITO,TIPO
7,El sistema podrá realizar copias de seguridad automáticas de los datos comerciales y restaurarlos a pedido,O
7,El sistema mantendrá una seguridad constante. Cualquier cambio en las contraseñas y/o permisos de los usuarios debería tener efecto en todas las partes del Sistema.,SE
7,El sistema controlará de forma granular los derechos de acceso a todos los subsistemas principales. Debería ser posible asignar derechos de acceso a todos los subsistemas de forma independiente.,SE
7,El Sistema deberá cumplir con todas las normas contables aplicables. La versión final del Sistema debe pasar con éxito una auditoría independiente realizada por un auditor certificado.,L
7,El Sistema no requerirá licencias adicionales de terceros que resulten en tarifas de regalías.,O
7,El sistema permitirá la generación de documentos de ajuste de cantidad de inventario a pedido,F
7,El sistema permitirá la generación a pedido de todos los documentos de ajuste de cantidad de inventario desde cierto momento,F
7,El subsistema IQA tendrá en cuenta el estado actual del inventario y ajustará el inventario de ingredientes sustitutivos en consecuencia,F
7,"El Sistema permitirá ingresar, almacenar y modificar fórmulas de producto.",F
7,Las fórmulas de los productos permitirán el uso de semiproductos que tengan fórmulas propias,F
7,Los ingredientes de la fórmula del producto permitirán definir los ingredientes sustitutivos,F
7,El subsistema PFE introducirá automáticamente los ingredientes sustitutivos de la fórmula del producto,F
7,Los ingredientes sustitutivos de la fórmula se mantendrán en orden persistente,F
7,"El producto permitirá ingresar, almacenar y modificar los menús de productos utilizados por los terminales POS.",F
7,El subsistema PME permitirá crear menús de productos basados en la lista de productos que se mantiene en el sistema contable,F
7,El subsistema PME permitirá mantener submenús dentro de menús y productos dentro de submenús en un orden administrado y persistente,F
7,El subsistema PME permitirá que un producto exista en más de un submenú,F
7,El sistema RMS tendrá el aspecto y la sensación de Windows XP y utilizará futuras GUI para que su uso sea intuitivo,F
7,El sistema generará un documento de ajuste de cantidad de inventario basado en los datos de ventas diarias del producto y las fórmulas del producto.,F
7,El sistema generará un documento de ajuste de cantidad de inventario automáticamente cuando los datos diarios de ventas de productos estén disponibles,F
8,El administrador podrá activar una tarjeta prepaga a través de la sección Administración en menos de 5 segundos,PE
8,El cliente podrá verificar el estado de su tarjeta prepaga ingresando el número PIN en menos de 5 segundos.,PE
8,"El sistema permitirá que los clientes se registren en el sitio web como un usuario de pago por uso en menos de 5 minutos.",PE
8,El sistema permitirá que los clientes se registren en el sitio web como un usuario de suscriptor de películas ilimitado en menos de 10 minutos.,PE
8,"El sistema permitirá que los clientes existentes inicien sesión en el sitio web con su dirección de correo electrónico y contraseña en menos de 5 segundos",PE
8,"El sistema permitirá que los clientes cancelen su cuenta. El proceso no llevará más de 2 minutos. La base de datos marcará la cuenta como inactiva y el usuario no podrá iniciar sesión en el sitio web.",PE
8,El sistema permitirá al administrador desactivar una cuenta de cliente en menos de 1 minuto. El cliente ya no podrá acceder al sitio web.,PE
8,El sistema permitirá al administrador agregar/eliminar películas en el sitio web en menos de 5 minutos. La información de la película ingresada se almacenará en la base de datos y ahora estará disponible en el sitio web.,PE
8,El sistema permitirá que el administrador agregue/elimine categorías en el sitio web en menos de 5 minutos,PE
8,El sistema permitirá que Izogn Manager acceda a las estadísticas de uso y ventas en menos de 2 minutos,PE
8,El sistema permitirá a los administradores generar pines prepagos únicos en menos de 2 minutos y generar un archivo de Excel con los PIN generados.,PE
8,El sitio web será atractivo para todos los públicos. El sitio web debe parecer divertido y los colores deben ser brillantes y vibrantes.,LF
8,"El sitio web debe tener un toque africano, pero no debe alienar a los no africanos. El sitio web debe utilizar animaciones en las páginas que describen los servicios para captar la atención de los usuarios y animarlos a registrarse.",LF
8,"El diseño del sitio web debe ser moderno, limpio y conciso",LF
8,El producto debería poder ser utilizado por el 90% de los usuarios novatos en Internet,US
8,Los usuarios solo deben tener que navegar por un máximo de 4 páginas para crear una cuenta en el sitio web,US
8,Los usuarios deberían poder acceder a sus películas en streaming en menos de 2 clics después de iniciar sesión en el sitio web,US
8,Una encuesta anónima mostrará que el 70% de los clientes se sienten cómodos comprando películas en streaming después de 2 semanas usando el sitio web,US
8,Una encuesta anónima mostrará que el 95% de los clientes se sienten cómodos usando y comprando tarjetas prepagas después de un mes de usar el sistema,US
8,El producto conservará la información y las preferencias de compra del cliente,US
8,El producto será fácil para los clientes principiantes en Internet para comprar y ver películas en tiempo real. Los clientes deberían poder comprar y ver una película predeterminada en menos de 3 minutos.,US
8,El producto utilizará símbolos y palabras que los usuarios familiarizados con los sitios web puedan comprender de forma natural,US
8,El sitio web utilizará las convenciones estándar de Internet al interactuar con el usuario,US
8,"Cualquier interfaz entre un usuario y el sistema automatizado tendrá un tiempo de respuesta máximo de 5 segundos, a menos que se indique una excepción a continuación",PE
8,"Al comprar una película en streaming o una tarjeta prepaga mediante tarjeta de crédito, el tiempo de procesamiento debe tener un tiempo de respuesta máximo de 15 segundos",PE
8,"Cuando se transmite una película, el tiempo de almacenamiento en búfer no debe ser superior a 10 segundos (más cualquier latencia en la conexión del usuario)",PE
8,"Mientras se transmite una película, el almacenamiento en búfer solo debe ocurrir si hay latencia en la conexión del usuario",PE
8,Toda la información de la tarjeta de crédito estará protegida en el servidor y solo podrán acceder a ella los administradores autorizados de Izogn. La información se cifrará en la base de datos.,SE
8,"El sitio web estará disponible para su uso las 24 horas del día, los 365 días del año",A
8,"El sitio web alcanzará el 99,5% de tiempo de actividad",A
8,Todas las películas se transmitirán a pedido en cualquier momento del día,A
8,El sitio web seguirá funcionando si el servidor de transmisión deja de funcionar,FT
8,El sitio web seguirá funcionando si la pasarela de pago deja de funcionar,FT
8,El servidor de transmisión admitirá 50 conexiones de transmisión simultáneas,SC
8,El servidor de transmisión admitirá un máximo de 700 películas; se pueden agregar nuevos servidores para admitir más películas.,SC
8,El servidor admitirá un máximo de 1000 usuarios simultáneos,SC
8,El sitio web deberá tener capacidad para 100000 clientes,SC
8,Se espera que el producto funcione dentro del presupuesto máximo de mantenimiento durante un mínimo de 2 años,MN
8,Se podrá acceder a todos los aspectos del sitio web mediante un navegador web a través de Internet,O
8,Se utilizará el mismo hardware compatible con el sitio web actual para admitir el nuevo sistema,O
8,"Debemos poder interactuar con los siguientes navegadores: IE 5.X 6.0, Netscape 6.x 7.x 8.x y Firefox 1.0.",O
8,El sitio web debe interactuar con la API CyberSource para procesar transacciones con tarjeta de crédito,O
8,El sitio web debe estar en pleno funcionamiento con MSN TV2.,O
8,Las películas se codificarán y transmitirán a través de Windows Media Player 9.0.,O
8,Las películas se codificarán para transmisiones de 56k y 256k.,O
8,Las actualizaciones promocionales del sitio web deberían tardar un día en actualizarse,MN
8,El administrador de Izogn debe poder actualizar los listados de categorías en el sitio web en 2 minutos,PE
8,Izogn Administrator debe poder agregar nuevos productos al sitio web en 2 minutos,PE
8,El sistema proporcionará un número gratuito 800 las 24 horas para brindar asistencia a sus clientes,A
8,El sitio web proporcionará una sección de ayuda con respuestas y soluciones a problemas comunes,US
8,El personal de Velkat estará disponible para soporte telefónico entre las 7 am y las 7 pm de lunes a viernes para brindar soporte técnico a los administradores de Izogn.,A
8,El producto debe poder instalarse en el entorno especificado dentro de 1 día hábil.,O
8,Solo los clientes registrados pueden comprar películas en streaming,SE
8,Un cliente solo puede transmitir una película si la compró y está dentro del período de visualización de 2 días,SE
8,Solo el personal autorizado puede acceder a los registros de los clientes en la base de datos,SE
8,Solo los administradores pueden activar una tarjeta prepago,SE
8,Solo el personal autorizado puede acceder a la información de ventas,SE
8,El sitio web evitará que sus datos se corrompan cuando se ingresan datos incorrectos,SE
8,El sitio web se protegerá a sí mismo de abusos intencionales y notificará al administrador en todos los casos,SE
8,Se ejecutarán scripts de integridad de datos semanalmente para verificar la integridad de la base de datos,SE
8,El sitio web debe informar a sus usuarios de sus prácticas de información antes de recopilar datos de ellos a través de una Política de privacidad accesible en todas las páginas del sitio web.,SE
8,El sistema notificará a los clientes los cambios en su política de información.,SE
8,El sistema revelará información privada solo de conformidad con la política de información de la organización,SE
8,Toda la información del cliente se almacenará en una base de datos segura accesible solo para el personal autorizado,SE
8,Toda la información de la tarjeta de crédito se cifrará en la base de datos,SE
8,El servidor de transmisión tendrá un software antivirus para evitar la infección de virus maliciosos,SE
8,El sitio web debe atender a todas las tribus de Nigeria,LF
8,El sitio web no debe ser ofensivo para grupos religiosos o étnicos,LF
8,"El sitio web debería atraer a todos los africanos, no solo a los nigerianos",LF
8,El sitio web debe usar Flash para proporcionar animación en la página de inicio.,O
8,IzognMovies deberá cumplir con los requisitos de licencia establecidos por las organizaciones apropiadas para transmitir películas africanas,L
8,El sitio web cumplirá con los estándares W3C.,L
8,El código PHP cumplirá con los estándares PEAR.,L
8,El sitio web permitirá a los clientes buscar películas por actor o director,F
8,"Al ver los detalles de una película, el sitio web mostrará la descripción de las películas que el actor y el director ingresaron por el administrador.",F
8,El sitio web deberá solicitar y autorizar el pago con tarjeta de crédito antes de permitir que un usuario transmita una película,F
8,Se podrá transmitir la película comprada a través de Windows Media Player hasta 2 días después de la fecha de compra,F
8,El sitio web permitirá a los clientes buscar películas por categorías ingresadas por el administrador de izogn.,F
8,El sitio web permitirá a los clientes ver reseñas de películas seleccionadas por otros clientes,F
8,El sitio web permitirá a los clientes agregar su propia reseña de película para una película seleccionada,F
8,El sitio web permitirá al administrador de Izogn aprobar una revisión publicada por un cliente,F
8,El sistema permitirá a los clientes pagar por una película en streaming con una tarjeta prepaga,F
8,"El sitio web permitirá a los clientes comprar tarjetas prepagas por valor de $5, $10 o $20, ya sea mediante tarjeta de crédito o mediante la opción de pago por correo",F
8,El sistema actualizará automáticamente la página principal del sitio web todos los viernes y mostrará las 4 últimas películas que se han agregado al sitio web,F
8,"El sistema permitirá a los usuarios actualizar su información de facturación y contacto a través de la sección Mi cuenta del sitio web.",F
8,Las tarjetas prepagas se distribuirán por correo electrónico o mediante una tarjeta de papel impresa,F
8,Solo los clientes registrados pueden comprar películas en streaming,F
8,Las películas solo se pueden transmitir si el cliente ha comprado una película y está dentro del período de 2 días para transmitir la película,F
8,El sitio web debe poder admitir períodos de prueba gratuitos con varios parámetros establecidos por Izogn Manager,F
8,Todas las ventas de películas en streaming se registrarán en la base de datos y el administrador podrá acceder a ellas,F
8,Toda la información del cliente registrado se almacenará y mantendrá en la base de datos incluso después de que el cliente cancele su cuenta,F
8,Las estadísticas de uso diario deben estar registradas y ser accesibles por el administrador,F
8,El propietario tendrá acceso gratuito a todas las películas en streaming,F
9,El tiempo total del ciclo de clientes potenciales debe completarse en 5 minutos para el 90% del volumen de clientes potenciales entre las horas hábiles de 8AM CST a 8PM CST; luego 3 minutos para el 99% del volumen de clientes potenciales fuera del horario comercial.,PE
9,Ninguna evaluación de clientes potenciales se completará en un período de tiempo superior a 25 segundos para el 97% de todos los clientes potenciales procesados,PE
9,"Para clientes potenciales que procesan más de 25 segundos, el sistema registrará el evento y la duración",PE
9,El proceso debe ajustarse a las condiciones de tiempo de procesamiento establecidas por el proceso de asignación automática de representantes en el que se asigna un cliente potencial dentro de los 3 minutos del ciclo de vida total,PE
9,El proceso de lavado de plomo operará dentro de la estructura de servicio web física establecida,O
9,"El proceso de lavado debe utilizar un formato de datos neutral no vinculante, como xml, al recibir y procesar datos de clientes potenciales.",O
9,"Los informes de defectos estarán disponibles para las unidades técnicas las 24 horas del día, los 7 días de la semana",A
9,Los parámetros de lavado se actualizarán durante las horas de mantenimiento programadas,MN
9,El proveedor verificará el cliente potencial no válido,F
9,El proveedor enviará un registro de validación de crédito para aplicarlo al sistema de facturación empresarial,F
9,"Si un cliente potencial se puntúa en el rango alto, el sistema proporcionará los datos del cliente potencial y la puntuación al sistema empresarial",F
9,La función de lavado de clientes potenciales validará todos los clientes potenciales recibidos por el servicio web para obtener datos válidos,F
9,La función de lavado de clientes potenciales insertará todos los clientes potenciales capturados por el servicio web,F
9,"Si el puntaje de los clientes potenciales se encuentra dentro del puntaje promedio alto, entonces será procesado por la funcionalidad ARA",F
9,"Si el puntaje de los clientes potenciales se encuentra dentro del promedio medio, un coordinador de inscripciones lo establecerá para la verificación manual a través del sistema de eleads",F
9,"Si la puntuación de los clientes potenciales cae dentro del promedio bajo, se devolverá al proveedor proveedor",F
9,La función de lavado de clientes potenciales recopilará información de puntuación académica y de contacto para obtener una puntuación total,F
9,La función de lavado de cables utilizará los parámetros proporcionados por la empresa y las escuelas para puntuar parte del plomo.,F
9,La función de lavado de clientes potenciales devolverá los datos del cliente potencial suministrados al proveedor junto con el motivo del rechazo.,F
9,La función de lavado de cables tendrá una interfaz en la que se pueden mantener los parámetros de datos de los cables,F
9,La función de lavado de clientes potenciales verificará la autenticación y los derechos de los usuarios para realizar actualizaciones de parámetros,F
9,La función de lavado de clientes potenciales almacenará los posibles duplicados de clientes potenciales devueltos por el sistema empresarial.,F
9,"Antes de enviar el cliente potencial al sistema empresarial, la función de lavado de clientes potenciales asignará el cliente potencial a un representante de admisiones",F
9,La función de lavado de clientes potenciales recibirá una lista de períodos de representantes disponibles del sistema empresarial,F
10,El producto simulará el aspecto de los barcos en el mar,LF
10,El producto debe mostrar las cuadrículas dentro de un círculo como una vista desde un periscopio,LF
10,El producto mostrará cada tipo de barco en una cuadrícula utilizando una imagen del tipo específico de barco,LF
10,"Cuando el jugador atacante realiza un tiro, el producto simulará el sonido de un barco en el mar",LF
10,"Cuando un disparo se marca como fallado, el producto simulará el sonido de un disparo que no alcanza su objetivo",LF
10,"Cuando un disparo se marca como un impacto, el producto simulará el sonido de un disparo al dar en el blanco.",LF
10,"Cuando se hunde un barco, el producto simulará el sonido de un barco que se hunde",LF
10,"El producto estará disponible las 24 horas del día, los siete días de la semana",A
10,El producto podrá manejar una gran cantidad de juegos simultáneamente,PE
10,El tiempo de respuesta será lo suficientemente rápido para mantener el flujo del juego. El tiempo de respuesta no será superior a 2 segundos para el 95% de las respuestas ni superior al 4% para el resto de respuestas.,PE
10,El producto protegerá la identidad de los jugadores. El producto no proporcionará a los jugadores acceso a información que pueda revelar la identidad de otro jugador.,PE
10,El producto debe ser intuitivo y autoexplicativo. Nueve de cada diez usuarios podrán completar con éxito un juego sin entrenamiento.,US
10,"El producto estará disponible para jugadores que entiendan inglés, español y francés. El producto permitirá al usuario seleccionar el idioma al acceder al producto.",US
10,El producto no proporcionará a los jugadores acceso a información que pueda revelar la identidad de otro jugador,SE
10,El tiempo de respuesta será lo suficientemente rápido para mantener el flujo del juego. El tiempo de respuesta no será superior a 2 segundos para el 95% de las respuestas ni superior al 4% para el resto de respuestas.,PE
10,El producto deberá mantener una lista de jugadores.,F
10,El producto permitirá al usuario identificarse como jugador,F
10,"Una vez que se ha iniciado un juego, el producto hará que los jugadores asignados al juego no estén disponibles para la selección de la lista de jugadores",F
10,El producto permitirá que un usuario se elimine de la lista de jugadores en cualquier momento,F
10,El producto hará que los jugadores inactivos no estén disponibles para la selección de la lista de jugadores,F
10,El producto eliminará de la lista de jugadores a los jugadores que hayan estado inactivos durante 24 horas.,F
10,El producto permitirá que un jugador inicie un juego seleccionando otro jugador disponible de la lista de jugadores.,F
10,"Una vez que se inicia un juego, el producto debe mostrar una cuadrícula defensiva para cada jugador",F
10,"Una vez que se inicia un juego, el producto mostrará una cuadrícula ofensiva para cada jugador.",F
10,El producto evitará que un jugador vea las cuadrículas ofensivas o defensivas del otro jugador,F
10,"Una vez que se inicia un juego, el producto permitirá que cada jugador coloque sus 5 barcos en sus respectivas cuadrículas defensivas.",F
10,El producto permitirá que un jugador coloque los barcos horizontalmente en su cuadrícula,F
10,El producto permitirá al jugador colocar los barcos verticalmente en su cuadrícula.,F
10,El producto permitirá al jugador colocar los barcos en diagonal en su cuadrícula,F
10,El producto evitará que el jugador se superponga a los barcos en su cuadrícula.,F
10,"Cuando ambos jugadores hayan colocado sus 5 barcos en sus cuadrículas defensivas, el producto definirá el estado de cada jugador para el primer turno.",F
10,"Para cada turno, el producto identificará a un jugador como estado ofensivo y a un jugador como estado defensivo.",F
10,El producto mantendrá el estatus de cada jugador durante un turno ofensivo o defensivo,F
10,"Al comienzo de cada turno, el producto notificará a cada jugador su estado.",F
10,"Para cada turno, el producto permitirá al jugador ofensivo definir un tiro.",F
10,"Para cada disparo, el producto examinará la cuadrícula defensiva del jugador defensivo para determinar si el disparo fue un hit o un error.",F
10,"Para cada disparo, el producto notificará a los jugadores si el disparo fue acertado o fallido",F
10,"Para cada disparo, el producto marcará el disparo como un hit o un error en la cuadrícula defensiva del jugador defensivo.",F
10,"Para cada disparo, el producto marcará el disparo como un hit o un error en la cuadrícula ofensiva del jugador ofensivo.",F
10,"Cuando el impacto provoque el hundimiento de un barco, el producto notificará a los jugadores que el barco se hundió.",F
10,"Cuando el impacto provoque el hundimiento de un barco, el producto marcará el barco como hundido en la cuadrícula defensiva del jugador defensivo.",F
10,"Cuando el impacto provoque el hundimiento de un barco, el producto indicará el tipo de barco hundido en la cuadrícula defensiva del jugador defensivo.",F
10,"Cuando el impacto resulte en el hundimiento de un barco, el producto marcará el barco como hundido en la cuadrícula ofensiva del jugador ofensivo.",F
10,"Si el tiro fue marcado como un golpe, el producto permitirá al jugador ofensivo definir un tiro.",F
10,"Si el tiro fue marcado como un fallo, el producto cambiará el estado del jugador ofensivo a defensivo",F
10,"Si el tiro fue marcado como un fallo, el producto cambiará el estado del jugador defensivo a ofensivo",F
10,El producto continuará asignando turnos hasta que finalice el juego,F
10,El producto terminará un juego cuando un impacto del jugador ofensivo provoque el hundimiento del último de los barcos del jugador defensivo que no habían sido previamente marcados como hundidos.,F
10,El producto permitirá a un jugador finalizar un juego en cualquier momento durante el juego.,F
10,"Cuando finaliza un juego, el producto notificará a los jugadores que el juego ha terminado.",F
10,"La notificación del final del juego incluirá el motivo por el que finalizó el juego (es decir, un jugador ha ganado el juego o un jugador ha terminado el juego).",F
10,"Cuando finaliza un juego, el producto permitirá que cada jugador se identifique como un jugador disponible en la lista de jugadores.",F
10,"Cuando finaliza un juego, el producto permitirá que cada jugador se elimine de la lista de jugadores.",F
11,El sistema debe ser fácil de usar para las personas que llaman y los supervisores. Las personas que llaman y los supervisores deben poder realizar cualquier tarea del sistema en 2 minutos.,US
11,El sistema será fácil de aprender para los llamantes y supervisores. Las personas que llaman y los supervisores deben aprender a usar el sistema en 10 minutos.,US
11,"El sistema debe tener un diseño responsivo. En el Centro de TeleServicios DePaul, cuando un supervisor usa el sistema para ver la programación de las personas que llaman, el tiempo de respuesta del sistema no debe ser más de 2 segundos el 90% del tiempo y no más de 5 segundos el resto del tiempo.",PE
11,"En una conexión de 56k, el tiempo de respuesta del sistema para todas las operaciones no debe ser superior a 6 segundos el 90% del tiempo",PE
11,"En una conexión de 112k o más rápida, el tiempo de respuesta del sistema para todas las operaciones no debe ser superior a 3 segundos el 90% del tiempo",PE
11,El sistema tendrá alta disponibilidad todos los días del año. El sistema debe estar disponible para su uso entre las 12:00 a.m. y las 6:00 p.m. todos los días del año,A
11,El sistema debe estar disponible para su uso entre las 7:00 a.m. Y las 11:59 p.m. todos los días del año,A
11,El producto debe ser independiente del navegador de Internet. El producto debe ejecutarse utilizando Internet Explorer y Netscape Navigator.,MN
11,El producto debe garantizar que solo los supervisores puedan anunciar los espacios de tiempo vacíos. El producto debe garantizar que los supervisores puedan acceder a los espacios de tiempo vacíos,SE
11,El producto debe garantizar que solo los supervisores puedan ingresar al horario de una persona que llama. El producto debe garantizar que los supervisores puedan acceder a los espacios de tiempo vacíos de publicidad,SE
11,El producto debe garantizar que solo los supervisores puedan ver el horario de todas las personas que llaman. El producto debe garantizar que los supervisores puedan acceder a los espacios de tiempo vacíos de publicidad ,SE
11,"La interfaz debe tener un aspecto simple. En la encuesta de interfaz y usabilidad, el 90% de los probadores beta deben informar que la interfaz es suficientemente simple.",LF
